<!ELEMENT city_report (metadata, indicators, transport, accommodation, highlights, districts?, description, wiki_intro?, landmark_image?, nightlife?)>
<!ATTLIST city_report 
    appeal_score CDATA #REQUIRED>

<!ELEMENT metadata (title, name_it, flag, source_url)>
<!ELEMENT title (#PCDATA)>
<!ELEMENT name_it (#PCDATA)>
<!ELEMENT flag (#PCDATA)>
<!-- Canonical URI/IRI of the city: used as microdata itemid in the HTML so that
     the identifiers in the site correspond exactly to those in the documents -->
<!ELEMENT source_url (#PCDATA)>

<!ELEMENT indicators (hotel_count, hotel_price, safety, environment, cost_index, economic_accessibility)>
<!ELEMENT hotel_count (#PCDATA)>
<!ELEMENT hotel_price (#PCDATA)>

<!ELEMENT safety EMPTY>
<!ATTLIST safety index_score CDATA #REQUIRED>

<!ELEMENT environment EMPTY>
<!ATTLIST environment green_score CDATA #REQUIRED>

<!ELEMENT cost_index EMPTY>
<!ATTLIST cost_index value CDATA #REQUIRED>

<!ELEMENT economic_accessibility EMPTY>
<!ATTLIST economic_accessibility score CDATA #REQUIRED>

<!ELEMENT transport (#PCDATA | b | i | link)*>
<!ELEMENT accommodation (hotel*)>
<!ELEMENT hotel (name, price)>
<!ELEMENT price (#PCDATA)>

<!ELEMENT highlights (attraction*)>
<!ELEMENT attraction (name, description)>
<!ATTLIST attraction 
    lat CDATA #REQUIRED 
    lon CDATA #REQUIRED>

<!ELEMENT districts (district*)>
<!ELEMENT district (name, description)>

<!ELEMENT name (#PCDATA)>
<!ELEMENT description (#PCDATA | b | i | link)*>
<!ELEMENT wiki_intro (#PCDATA | b | i | link)*>
<!ELEMENT landmark_image (#PCDATA)>

<!-- Inline elements for mixed content (content-model misto) -->
<!ELEMENT b (#PCDATA)>
<!ELEMENT i (#PCDATA)>
<!ELEMENT link (#PCDATA)>
<!ATTLIST link href CDATA #REQUIRED>

<!ELEMENT nightlife (venue*)>
<!ELEMENT venue (name, category)>
<!ATTLIST venue lat CDATA #IMPLIED
               lon CDATA #IMPLIED>
<!ELEMENT category (#PCDATA)>