<?xml version='1.0' encoding='UTF-8'?>
<!DOCTYPE city_report SYSTEM "../city_report.dtd">
<city_report appeal_score="59.1" currency="BGN" region="eastern">
  <metadata>
    <title>Sofia</title>
    <name_it>Sofia</name_it>
    <flag>🇧🇬</flag>
    <source_url>https://en.wikivoyage.org/wiki/Sofia</source_url>
  </metadata>
  <indicators>
    <hotel_count>18</hotel_count>
    <hotel_price>87.88</hotel_price>
    <safety index_score="58.4"/>
    <environment green_score="63"/>
    <cost_index value="47.5"/>
    <economic_accessibility score="52.5"/>
  </indicators>
  <transport><b>Sofia</b> Metro Line 4 (<i>Yellow</i>) operates service to the airport between 05:30 and 24:00. The stop is a few metres outside of Terminal 2; follow signs for "Subway" until you leave the southeast corner of the building. The journey to the city centre takes 20–30 minutes.</transport>
  <accommodation>
    <hotel>
      <name>Peter Pan Hostel</name>
      <price>Private €12-14</price>
    </hotel>
    <hotel>
      <name>Levitt Hostel</name>
      <price>€10</price>
    </hotel>
    <hotel>
      <name>Crosspoint Sofia Hostel</name>
      <price>€9-18</price>
    </hotel>
    <hotel>
      <name>Hostel Mostel</name>
      <price>From €9</price>
    </hotel>
    <hotel>
      <name>Nightingale Hostel</name>
      <price>€7-12</price>
    </hotel>
  </accommodation>
  <highlights>
    <attraction lat="42.6958" lon="23.3328">
      <name>Nevsky Cathedral</name>
      <description>One of the largest Orthodox cathedrals in the world.</description>
    </attraction>
    <attraction lat="42.6911" lon="23.3203">
      <name>Vitosha Boulevard</name>
      <description>Main commercial street with views of Vitosha Mountain.</description>
    </attraction>
    <attraction lat="42.6447" lon="23.2661">
      <name>Boyana Church</name>
      <description>Medieval church with world-famous frescoes.</description>
    </attraction>
    <attraction lat="42.6978" lon="23.3225">
      <name>Serdica Ruins</name>
      <description>Ancient Roman ruins in the center of Sofia.</description>
    </attraction>
    <attraction lat="42.6936" lon="23.3267">
      <name>National Theater</name>
      <description>Beautiful Neoclassical theater building.</description>
    </attraction>
    <attraction lat="42.6969" lon="23.3228">
      <name>St. George Rotunda</name>
      <description>The oldest building in Sofia, a 4th-century church.</description>
    </attraction>
    <attraction lat="42.6994" lon="23.3225">
      <name>Banya Bashi Mosque</name>
      <description>16th-century mosque built over natural thermal spas.</description>
    </attraction>
    <attraction lat="42.655" lon="23.2708">
      <name>National History Museum</name>
      <description>Largest museum in Bulgaria with the Thracian treasures.</description>
    </attraction>
    <attraction lat="42.6967" lon="23.3214">
      <name>Sveta Nedelya</name>
      <description>Medieval Orthodox cathedral in the heart of the city.</description>
    </attraction>
    <attraction lat="42.6975" lon="23.3222">
      <name>Largo</name>
      <description>Architectural ensemble of Socialist Classicism.</description>
    </attraction>
  </highlights>
  <description>Located at the foot of Mount Vitosha, <b>Sofia</b> offers unbeatable living costs and immediate access to mountain nature. It is one of the emerging capitals with the highest potential for economic and urban growth.</description>
  <wiki_intro><b>Sofia</b> (София) is the capital and largest city of Bulgaria, with about 2 million citizens (including suburbs). It is a dynamic European capital, distinguished by its unique combination of European and communist-style architecture as well as many beautiful Orthodox churches, including the grand Alexander Nevsky Cathedral and the medieval frescos of Boyana Church (a UNESCO World Heritage Site). Furthermore, it claims to be one of the few European capitals with beautiful scenery and a developed ski-resort so close to it, the Vitosha mountain. The city has had several names over the past 2,500 years: the Romans called it Serdika when they took it from a Thracian tribe with a similar name, the Slavs called it Sredets when they integrated it into the first Bulgarian Empire, and the Ottomans called it <b>Sofia</b>, the Greek word for "wisdom", when they made it their base for the Balkans. You can still find remnants from each of these societies in parts of the city. People first came here for the hot water springs that still flow abundantly in the centre of the city. Many of the later Roman emperors took a liking to these thermal baths, and developed the city into a regional capital; Emperor Constantine even considered building his imperial capital here instead of Constantinople. From there, <b>Sofia</b> has had ups and downs; sacked by the Huns, then a fortress for the first Bulgarians, then sieged and rebuilt by the Ottomans. The decline of <b>Sofia</b> towards the end of the Ottoman Empire was followed by the rejuvenation after the Russian liberation in 1878, when <b>Sofia</b> was chosen as the capital of Bulgaria at the First National Constituent Assembly, and followed by a brisk and straightforward period of construction. During the Second World War, thousands of buildings were destroyed or damaged by bombing campaigns, until the Soviet Red Army occupied <b>Sofia</b> and established a Communist government, which constructed Stalinist Gothic public buildings and concrete tower blocks. Newer construction has led to glass-fronted office buildings and top-class residential neighbourhoods. *VisitSofia.bg, <b>Sofia</b>'s official tourist information website. Available in several languages, including English.
*
*
* *  Over 20 airlines operate service to/from <b>Sofia</b>, with direct flights to/from Athens, Paris, Vienna, London, Rome, Amsterdam, Munich, Warsaw and other European cities. There are also domestic flights from Varna and Burgas. Along with traditional carriers, some low-cost companies serving Bulgaria are EasyJet (to/from London-Gatwick, Madrid, Manchester) and Wizz Air (to/from Paris-Beauvais, Barcelona, Brussels-Charleroi, Dortmund, Eindhoven, London-Luton, Milan-Bergamo, Rome-Fiumicino, Valencia) and RyanAir.</wiki_intro>
  <landmark_image>assets/images/sofia.jpg</landmark_image>
  <nightlife>
    <venue lat="42.647392" lon="23.3725373" category="bar">
      <name>120ска</name>
    </venue>
    <venue lat="42.6862595" lon="23.3220992" category="bar">
      <name>3 oz. bar</name>
    </venue>
    <venue lat="42.6900767" lon="23.3204954" category="pub">
      <name>Ale House</name>
    </venue>
    <venue lat="42.6902288" lon="23.3393279" category="bar">
      <name>Art Club</name>
    </venue>
    <venue lat="42.6940747" lon="23.3186521" category="bar">
      <name>Baskerville</name>
    </venue>
    <venue lat="42.6913226" lon="23.3205792" category="bar">
      <name>Caligo</name>
    </venue>
    <venue lat="42.6869936" lon="23.2395698" category="bar">
      <name>Club 303</name>
    </venue>
    <venue lat="42.6946385" lon="23.3190705" category="bar">
      <name>Coda</name>
    </venue>
  </nightlife>
</city_report>
