<?xml version='1.0' encoding='UTF-8'?>
<!DOCTYPE city_report SYSTEM "../city_report.dtd">
<city_report appeal_score="69.3">
  <metadata>
    <title>Warsaw</title>
    <name_it>Warsaw</name_it>
    <flag>🇵🇱</flag>
    <source_url>https://en.wikipedia.org/wiki/Warsaw</source_url>
  </metadata>
  <indicators>
    <hotel_count>0</hotel_count>
    <hotel_price>98.42</hotel_price>
    <safety index_score="74.8"/>
    <environment green_score="75"/>
    <cost_index value="53.2"/>
    <economic_accessibility score="46.8"/>
  </indicators>
  <transport>Regular <b>Warsaw</b> transport tickets issued by ZTM (the local transport operator which runs city buses, trams and the metro) are valid on SKM train services between the airport and <b>Warsaw</b>. The airport is in fare zone 1 so a single adult ride is 3.40 zł. If you need a bus at the other end, get a one-transfer ticket (valid 75 min) for 4.40 zł.</transport>
  <accommodation/>
  <highlights>
    <attraction lat="52.2479" lon="21.0144">
      <name>Royal Castle</name>
      <description>Reconstructed castle and former royal residence.</description>
    </attraction>
    <attraction lat="52.2497" lon="21.0122">
      <name>Old Town Market</name>
      <description>The historical heart and oldest part of Warsaw.</description>
    </attraction>
    <attraction lat="52.2153" lon="21.0347">
      <name>Lazienki Park</name>
      <description>Largest park with a palace on the water.</description>
    </attraction>
    <attraction lat="52.2317" lon="21.0061">
      <name>Palace of Culture</name>
      <description>Iconic socialist-realist skyscraper and city landmark.</description>
    </attraction>
    <attraction lat="52.1642" lon="21.0894">
      <name>Wilanow Palace</name>
      <description>Baroque royal palace survived the wars.</description>
    </attraction>
    <attraction lat="52.2325" lon="20.9808">
      <name>Uprising Museum</name>
      <description>Museum dedicated to the Warsaw Uprising of 1944.</description>
    </attraction>
    <attraction lat="52.2444" lon="21.025">
      <name>Vistula Boulevards</name>
      <description>Modern riverside promenade with bars and views.</description>
    </attraction>
    <attraction lat="52.2494" lon="20.9931">
      <name>POLIN Museum</name>
      <description>Museum of the History of Polish Jews.</description>
    </attraction>
    <attraction lat="52.2369" lon="21.0089">
      <name>Saxon Garden</name>
      <description>Oldest public park in the city.</description>
    </attraction>
    <attraction lat="52.25" lon="21.0333">
      <name>Praga District</name>
      <description>Artistic district on the right bank of the Vistula.</description>
    </attraction>
  </highlights>
  <districts>
    <district>
      <name>Old and New Town</name>
      <description>Quartiere di Warsaw.</description>
    </district>
    <district>
      <name>Śródmieście</name>
      <description>Quartiere di Warsaw.</description>
    </district>
    <district>
      <name>Western Centre</name>
      <description>Quartiere di Warsaw.</description>
    </district>
    <district>
      <name>Praga</name>
      <description>Quartiere di Warsaw.</description>
    </district>
    <district>
      <name>South</name>
      <description>Quartiere di Warsaw.</description>
    </district>
  </districts>
  <description>An extraordinary example of reconstruction and resilience, <b>Warsaw</b> is now a vertical and dynamic metropolis. It combines a growing financial sector with large green spaces and improved urban safety.</description>
  <wiki_intro><b>Warsaw</b> (Polish: Warszawa) is Poland's capital and largest city. <b>Warsaw</b> is a bustling metropolis and one of the European Union's fastest-developing capitals and the Union's ninth most populous urban centre. It has a mixture of new and old in its eclectic architectural mix, and is constantly changing. There is a large variety of museums, galleries and other tourist attractions, and there is always something happening throughout the year. While sprawling, it is quite easy to navigate for tourists thanks to a good public transit system, and most important sights are quite close to each other. There is no shortage of accommodation options and a wide choice of restaurants and bars. <b>Warsaw</b>'s nightlife is also on the rebound, and a reborn cafe culture has taken over the city. A city of 1.8 million inhabitants (2021), it sits on the Vistula River (Polish: Wisła) in the middle of the country. <b>Warsaw</b>'s history of rapid development after many wars that ravaged and destroyed the city has earned it a reputation as a "phoenix city", able to recreate itself from the ruins and regain its erstwhile glory every time. During the Second World War, it suffered a fate similar to Rotterdam and Dresden in that it was almost completely razed, although in the case of <b>Warsaw</b> it was a much more tragic story of successive destruction and defeat. Due to the great efforts of its surviving inhabitants and, indeed the entire nation, it was rebuilt from a field of rubble, with its historic core recreated, but much of its heritage was lost. <b>Warsaw</b> also had one of the largest Jewish populations in Europe, which for the most part perished during the war, making <b>Warsaw</b> an important place of Holocaust remembrance. There are records of human settlements and economic activity in the area of what is now <b>Warsaw</b> from the 9th century onwards, but it wasn't until the 13th century that <b>Warsaw</b> was founded by the Dukes of Mazovia. While developing as an administrative and economic centre, it played second fiddle to Płock within Mazovia until the 15th century, and was by no means a match for Poland's former capital, Kraków. It gained growing importance due to its economic might and strategically important central location in Poland, cemented when the Polish Sejm (parliament of nobles) relocated there permanently in the 16th century, and it became the site of royal elections. In 1596, it became the de facto capital of the country when King Sigismund III Vasa decided to permanently relocate to what is now the Royal Castle in <b>Warsaw</b>. The city started to develop rapidly beyond the what is now the Old and New Town, as noblemen started moving in and building mansions and palaces around town. In the 17th century, Praga, on the right-hand side of the river Vistula, was incorporated as a separate town (and did not become a part of <b>Warsaw</b> until the 19th century).</wiki_intro>
  <landmark_image>assets/images/warsaw.jpg</landmark_image>
  <nightlife>
    <venue lat="52.2071732" lon="20.9724513">
      <name>Amarant</name>
      <category>pub</category>
    </venue>
    <venue lat="52.2294067" lon="21.0147013">
      <name>Azyl</name>
      <category>bar</category>
    </venue>
    <venue lat="52.2480169" lon="21.0455613">
      <name>Bar pod Kufelkiem</name>
      <category>pub</category>
    </venue>
    <venue lat="52.2247707" lon="21.0122492">
      <name>Beirut</name>
      <category>bar</category>
    </venue>
    <venue lat="52.1737627" lon="21.0450075">
      <name>Bez Słowa</name>
      <category>pub</category>
    </venue>
    <venue lat="52.2400168" lon="21.0765039">
      <name>Bluesky</name>
      <category>bar</category>
    </venue>
    <venue lat="52.2334668" lon="21.0202035">
      <name>Cafe Foksal</name>
      <category>pub</category>
    </venue>
    <venue lat="52.2178857" lon="21.0170602">
      <name>Cafe Rock'n'Roll</name>
      <category>pub</category>
    </venue>
  </nightlife>
</city_report>
