<?xml version='1.0' encoding='UTF-8'?>
<!DOCTYPE city_report SYSTEM "../city_report.dtd">
<city_report appeal_score="60.3" currency="RON" region="eastern">
  <metadata>
    <title>Bucharest</title>
    <name_it>Bucharest</name_it>
    <flag>🇷🇴</flag>
    <source_url>https://en.wikivoyage.org/wiki/Bucharest</source_url>
  </metadata>
  <indicators>
    <hotel_count>41</hotel_count>
    <hotel_price>90.47</hotel_price>
    <safety index_score="70.3"/>
    <environment green_score="55"/>
    <cost_index value="48.9"/>
    <economic_accessibility score="51.1"/>
  </indicators>
  <transport>Getting there and away: By bus – The Express Bus is usually the best option, as it is inexpensive (50–90 minutes ride) and runs frequently. However, it can get crowded (and it lacks space for luggage) and can get snarled in traffic. The airport bus stop is straight outside Arrivals on the ground floor.</transport>
  <accommodation>
    <hotel>
      <name>Apartamente Regim Hotelier Bucuresti</name>
      <price>40</price>
    </hotel>
    <hotel>
      <name>Short Term Apartments Rental</name>
      <price>40</price>
    </hotel>
    <hotel>
      <name>Camping Casa Alba</name>
      <price>Prezzo N/D</price>
    </hotel>
    <hotel>
      <name>Butterfly Villa Hostel</name>
      <price>From 12/night</price>
    </hotel>
    <hotel>
      <name>Midland Hostel</name>
      <price>from 8/night</price>
    </hotel>
  </accommodation>
  <highlights>
    <attraction lat="44.4275" lon="26.0872">
      <name>Palace of Parliament</name>
      <description>The world's second-largest administrative building.</description>
    </attraction>
    <attraction lat="44.4414" lon="26.0972">
      <name>Romanian Athenaeum</name>
      <description>Iconic concert hall and symbol of Romanian culture.</description>
    </attraction>
    <attraction lat="44.4715" lon="26.0762">
      <name>Village Museum</name>
      <description>Open-air museum showcasing traditional Romanian life.</description>
    </attraction>
    <attraction lat="44.4714" lon="26.0825">
      <name>Herastrau Park</name>
      <description>Large park surrounding a lake in northern Bucharest.</description>
    </attraction>
    <attraction lat="44.4672" lon="26.0784">
      <name>Arcul de Triumf</name>
      <description>Triumphal arch dedicated to Romania's WWI victory.</description>
    </attraction>
    <attraction lat="44.431" lon="26.101">
      <name>Old Town (Lipscani)</name>
      <description>Historical center with vibrant nightlife and architecture.</description>
    </attraction>
    <attraction lat="44.4314" lon="26.0997">
      <name>Stavropoleos Monastery</name>
      <description>Small Orthodox monastery known for its Brancovan style.</description>
    </attraction>
    <attraction lat="44.4394" lon="26.0975">
      <name>Revolution Square</name>
      <description>The site of major events during the 1989 revolution.</description>
    </attraction>
    <attraction lat="44.4397" lon="26.0958">
      <name>National Art Museum</name>
      <description>Art museum located in the former Royal Palace.</description>
    </attraction>
    <attraction lat="44.4318" lon="26.1017">
      <name>Carturesti Carusel</name>
      <description>Beautiful bookstore located in a restored 19th-century building.</description>
    </attraction>
  </highlights>
  <description>A city in strong technological expansion, <b>Bucharest</b> offers one of the best ratios between operating costs and digital infrastructure quality. Its profile is rapidly evolving toward Western European sustainability standards.</description>
  <wiki_intro><b>Bucharest</b> (Romanian: București) is Romania's capital and largest city. <b>Bucharest</b> has a very interesting mix of old and new: finding a 300-year-old church near a steel-and-glass tower that sits next to a communist-style building is commonplace in <b>Bucharest</b>. <b>Bucharest</b> offers some excellent attractions, and has cultivated a sophisticated, trendy, and modern sensibility that many have come to expect from a European capital.  <b>Bucharest</b> is the primary entry point into Romania, and the most important industrial and commercial centre of the country. With more than 2.1 million inhabitants in its urban area, <b>Bucharest</b> is one of the largest cities in Southeastern Europe. <b>Bucharest</b> is a booming city with many large infrastructure projects changing the old face of the city, which used to be known in the past as "The Little Paris". <b>Bucharest</b> has benefited from an economic boom along with the EU grants that have helped rebuild parts of the city, including the revamped old town. Those who have known <b>Bucharest</b> in the past will be surprised by the changes that are taking place. The largest finished project is the impressive Basarab overpass, which is Europe's widest cable bridge. <b>Bucharest</b>, like most of Romania, has a temperate-continental climate with hot summers and cold winters. This region of Romania gets all four seasons, although spring is brief and falls mainly in April. The average high daily temperature in summer is about 29&amp;amp;nbsp;°C and in winter about 2&amp;amp;nbsp;°C. It can get really hot and dry during the summer (30&amp;amp;nbsp;°C) and really cold during the winter (-20&amp;amp;nbsp;°C), even though temperatures below -12&amp;amp;nbsp;°C are extremely rare. Best time to visit is April through June, September through October and early December. <b>Bucharest</b> is in the Eastern European time zone (UTC+2, with a DST of UTC+3 from April to October). * Visitor information from Romania Tourism  The official language is Romanian, a Romance language which claims to be the closest currently-spoken relative to Vulgar Latin, but contains around 20% of loan words from Slavonic languages. Most younger educated people will speak English reasonably well and will likely be proficient in one or more second Romance languages; most educated people born before about 1980 will speak French, Spanish or Italian reasonably well. The Roma people (<i>Gypsies</i>) speak their native Romany, as well as Romanian, and sometimes English as well. Beyond that, as in any major city, there will be a smattering of other languages like Chinese, Arabic, Turkish, Hungarian and German. The IATA code corresponds to "all" airports in <b>Bucharest</b>, not a specific one.
* 
*  Getting there and away:
* By bus – The Express Bus is usually the best option, as it is inexpensive (50–90 minutes ride) and runs frequently. However, it can get crowded (and it lacks space for luggage) and can get snarled in traffic. The airport bus stop is straight outside Arrivals on the ground floor.</wiki_intro>
  <landmark_image>assets/images/bucharest.jpg</landmark_image>
  <nightlife>
    <venue lat="44.4421391" lon="26.0944235" category="bar">
      <name>112 Bar</name>
    </venue>
    <venue lat="44.4307357" lon="26.1018712" category="bar">
      <name>1974 Niște Domni și Fiii</name>
    </venue>
    <venue lat="44.4449566" lon="26.0962978" category="pub">
      <name>1UP Gamers Pub</name>
    </venue>
    <venue lat="44.4300616" lon="26.0973551" category="bar">
      <name>Abel's Wine Bar</name>
    </venue>
    <venue lat="44.4306672" lon="26.1013188" category="nightclub">
      <name>Agartha Club</name>
    </venue>
    <venue lat="44.4476748" lon="26.1060993" category="bar">
      <name>Alan Dala</name>
    </venue>
    <venue lat="44.4130209" lon="26.1688469" category="bar">
      <name>Alexa</name>
    </venue>
    <venue lat="44.4312812" lon="26.0999145" category="bar">
      <name>Altfel</name>
    </venue>
  </nightlife>
</city_report>
