<?xml version='1.0' encoding='UTF-8'?>
<!DOCTYPE city_report SYSTEM "../city_report.dtd">
<city_report appeal_score="65.2">
  <metadata>
    <title>Madrid</title>
    <name_it>Madrid</name_it>
    <flag>🇪🇸</flag>
    <source_url>https://en.wikivoyage.org/wiki/Madrid</source_url>
  </metadata>
  <indicators>
    <hotel_count>0</hotel_count>
    <hotel_price>119.88</hotel_price>
    <safety index_score="71.3"/>
    <environment green_score="74"/>
    <cost_index value="64.8"/>
    <economic_accessibility score="35.2"/>
  </indicators>
  <transport>To and from the airport During the day, Metro a popular best way to reach city centre. Line 8 (pink) runs from Nuevos Ministerios to Terminals 1,2&amp;3, Barajas town (no airport here, don't get off!) and T4. It runs from 06:00 to 01:30, taking 15 min from city to T123 and another 5 min to T4.</transport>
  <accommodation/>
  <highlights>
    <attraction lat="40.4138" lon="-3.6921">
      <name>Prado Museum</name>
      <description>Main Spanish national art museum.</description>
    </attraction>
    <attraction lat="40.4179" lon="-3.7144">
      <name>Royal Palace</name>
      <description>Official residence of the Spanish royal family.</description>
    </attraction>
    <attraction lat="40.4153" lon="-3.6839">
      <name>Retiro Park</name>
      <description>Large urban park with a lake and monuments.</description>
    </attraction>
    <attraction lat="40.4154" lon="-3.7074">
      <name>Plaza Mayor</name>
      <description>Central square in the heart of Madrid.</description>
    </attraction>
    <attraction lat="40.4169" lon="-3.7035">
      <name>Puerta del Sol</name>
      <description>Busy public square and 'Kilometre Zero' for Spanish roads.</description>
    </attraction>
    <attraction lat="40.4079" lon="-3.6946">
      <name>Reina Sofia Museum</name>
      <description>National museum of 20th-century art (Guernica).</description>
    </attraction>
    <attraction lat="40.4161" lon="-3.6949">
      <name>Thyssen-Bornemisza</name>
      <description>Major art museum forming the Golden Triangle of Art.</description>
    </attraction>
    <attraction lat="40.42" lon="-3.7011">
      <name>Gran Via</name>
      <description>Iconic shopping street with landmark architecture.</description>
    </attraction>
    <attraction lat="40.4531" lon="-3.6883">
      <name>Santiago Bernabéu</name>
      <description>Stadium and home ground of Real Madrid CF.</description>
    </attraction>
    <attraction lat="40.4241" lon="-3.7177">
      <name>Temple of Debod</name>
      <description>Ancient Egyptian temple rebuilt in Madrid.</description>
    </attraction>
  </highlights>
  <districts>
    <district>
      <name>Retiro-Paseo del Arte</name>
      <description>Quartiere di Madrid.</description>
    </district>
    <district>
      <name>Salamanca</name>
      <description>Quartiere di Madrid.</description>
    </district>
    <district>
      <name>Chamberí-Castellana</name>
      <description>Quartiere di Madrid.</description>
    </district>
    <district>
      <name>Moncloa</name>
      <description>Quartiere di Madrid.</description>
    </district>
    <district>
      <name>Arganzuela</name>
      <description>Quartiere di Madrid.</description>
    </district>
  </districts>
  <description>Famous for its social energy and broad tree-lined avenues, <b>Madrid</b> is investing heavily in 'urban forests' to counter heat. Its accessibility and safe nightlife make it an unmissable destination.</description>
  <wiki_intro><b>Madrid</b> is Spain's capital and largest city. A city that has been marked by Spain's varied and tumultuous history, <b>Madrid</b> has some of Europe's most impressive cultural and architectural heritage, which includes grand avenues, plazas, buildings and monuments, world-class art galleries and museums, highly popular football teams, and cultural events of international fame for everyone. <b>Madrid</b> is also renowned for gastronomic delights and a nightlife lasting up until dawn. <b>Madrid</b> is more often than not disregarded by tourists who gravitate to other parts of the country. But though it may appear to lack some of the breathtaking architecture of Barcelona, the frenetic energy of London and Berlin, or the flair of Paris and Rome, <b>Madrid</b> is a massive treasure chest that has something for those who are willing to get off the beaten tourist tracks. It might not be the most sought-after city, but those who seek out what <b>Madrid</b> has to offer will discover a city of unexpected beauty.  <b>Madrid</b> has over 3.4 million residents within the city limits and 7 million people live in the autonomous Community of <b>Madrid</b> region (as of 2025). <b>Madrid</b> is just northeast of the geographical centre of the Iberian Peninsula, in the middle of the Spanish central Castillian plateau (Meseta central), at an average altitude of . Nearly all of the most famous tourist areas are in the centre of the city including Puerta del Sol, Plaza Mayor, Palacio Real, and Plaza de Colón. The major streets in <b>Madrid</b> include the Gran Via, Alcalá Street, and Paseo de la Castellana. The climate of <b>Madrid</b> is continental, mainly dry and quite extreme at times. <b>Madrid</b> experiences a characteristically hot and dry summer, along with a fairly cold winter with frequent frosts during the night and occasional snowfalls. Spring and autumn are generally mild with the most rainfall concentrated in these seasons. Spring and autumn are definitely the best times to visit, especially the months of April, May, June, September and October. There is very little rainfall during summer and also less rainfall during winter. During winter, snow occurs sporadically; however, snow usually lasts only for a few days, but there is abundant snowfall in the adjacent mountain ranges nearby. <b>Madrid</b> is a city that goes back to the Spanish Muslims, but virtually nothing of <b>Madrid</b> before the Reconquista is left. A few historic city walls have been archeologically preserved but <b>Madrid</b> was by far overshadowed by Toledo (Roman Toletum) until the early modern era. To give just one example, construction on <b>Madrid</b> Cathedral did not start until the late 19th century, and only finished in the 1990s, as the archbishop of Toledo did not want to relinquish episcopal power, and the monarchs had moved the capital in part precisely to escape the power of Toledo's archbishop. The culture of <b>Madrid</b> was dominated by its royal history, centre of the Spanish Empire.</wiki_intro>
  <landmark_image>assets/images/madrid.jpg</landmark_image>
  <nightlife>
    <venue lat="40.4130638" lon="-3.7129344" category="bar">
      <name>Bar Barocco</name>
    </venue>
    <venue lat="40.4039506" lon="-3.7014278" category="pub">
      <name>Bar Díaz</name>
    </venue>
    <venue lat="40.4048223" lon="-3.6960055" category="pub">
      <name>Bar la familia</name>
    </venue>
    <venue lat="40.4041585" lon="-3.6959215" category="pub">
      <name>Bar Teide</name>
    </venue>
    <venue lat="40.4097328" lon="-3.7010866" category="pub">
      <name>Café Melo's</name>
    </venue>
    <venue lat="40.4108575" lon="-3.6957127" category="pub">
      <name>Casablanca</name>
    </venue>
    <venue lat="40.4118925" lon="-3.7109337" category="pub">
      <name>Cervecería San Andrés</name>
    </venue>
    <venue lat="40.4192413" lon="-3.7074836" category="pub">
      <name>Cervercería Erte</name>
    </venue>
  </nightlife>
</city_report>
