<?xml version='1.0' encoding='UTF-8'?>
<!DOCTYPE city_report SYSTEM "../city_report.dtd">
<city_report appeal_score="62.5">
  <metadata>
    <title>Riga</title>
    <name_it>Riga</name_it>
    <flag>🇱🇻</flag>
    <source_url>https://en.wikipedia.org/wiki/Riga</source_url>
  </metadata>
  <indicators>
    <hotel_count>0</hotel_count>
    <hotel_price>103.23</hotel_price>
    <safety index_score="62.1"/>
    <environment green_score="72"/>
    <cost_index value="55.8"/>
    <economic_accessibility score="44.2"/>
  </indicators>
  <transport>Bus route 22 runs between the airport and the old town, with a stop near the central bus and railway stations as well as old town. These buses operate as any other public transport in <b>Riga</b>; see <b>Riga</b>#Get_around for more information on riding the buses. The journey to the old town takes 30-40 minutes.</transport>
  <accommodation/>
  <highlights>
    <attraction lat="56.9491" lon="24.1053">
      <name>Old Town</name>
      <description>Historical heart of Riga with cobblestone streets.</description>
    </attraction>
    <attraction lat="56.9472" lon="24.1069">
      <name>House of Blackheads</name>
      <description>Historic building reconstructed after WWII.</description>
    </attraction>
    <attraction lat="56.9514" lon="24.1131">
      <name>Freedom Monument</name>
      <description>Memorial honoring soldiers killed in the War of Independence.</description>
    </attraction>
    <attraction lat="56.9475" lon="24.1094">
      <name>St. Peter's Church</name>
      <description>Gothic church with an observation tower.</description>
    </attraction>
    <attraction lat="56.9439" lon="24.1158">
      <name>Central Market</name>
      <description>Large market in former Zeppelin hangars.</description>
    </attraction>
    <attraction lat="56.9592" lon="24.1089">
      <name>Art Nouveau District</name>
      <description>Area with the highest concentration of Art Nouveau architecture.</description>
    </attraction>
    <attraction lat="56.9539" lon="24.1158">
      <name>Nativity Cathedral</name>
      <description>The largest Orthodox cathedral in the city.</description>
    </attraction>
    <attraction lat="56.9556" lon="24.1131">
      <name>Latvian National Museum</name>
      <description>Art museum in a magnificent historicist building.</description>
    </attraction>
    <attraction lat="56.9511" lon="24.1064">
      <name>Swedish Gate</name>
      <description>The only remaining gate from the old city walls.</description>
    </attraction>
    <attraction lat="56.9714" lon="24.2272">
      <name>Motor Museum</name>
      <description>Museum with a large collection of antique vehicles.</description>
    </attraction>
  </highlights>
  <districts>
    <district>
      <name>Vecrīga</name>
      <description>Quartiere di Riga.</description>
    </district>
    <district>
      <name>Centrs</name>
      <description>Quartiere di Riga.</description>
    </district>
    <district>
      <name>Outer East Bank</name>
      <description>Quartiere di Riga.</description>
    </district>
    <district>
      <name>Pārdaugava</name>
      <description>Quartiere di Riga.</description>
    </district>
  </districts>
  <description>Baltic pearl famous for Art Nouveau, <b>Riga</b> offers immense green spaces and a growing tech scene. Its economic accessibility makes it a strategic choice for young professionals and conscious travelers.</description>
  <wiki_intro><b>Riga</b> is the financial, creative, and cultural centre of Latvia. It is the capital and the largest city in Latvia, it is also the second largest city in the Baltic States after the Lithuanian capital Vilnius. The city lies on the Gulf of <b>Riga</b>, at the mouth of Daugava, <b>Riga</b> has a population of approximately 640,000 inhabitants, or 1/3 of the population of Latvia. The city was part of many empires throughout history, each of which has left its mark on the city. It is famous for Art Nouveau and wooden architecture. <b>Riga</b>'s historical centre is listed as a UNESCO World Heritage site. There are many administrative districts in <b>Riga</b>. However, almost all tourist attractions, historic buildings and hotels are contained within the borders of the relatively small and walkable Centra rajons district, which is made up of Vecrīga (the old town) and Centrs (the modern-day business district). However if you have already seen the more famous attractions in the city centre, the outer districts do have their own draws too. On both sides of the mouth of Daugava river, the Gulf of <b>Riga</b> offers extensive sandy seaside beaches, which can be reached by city bus or train. A nude beach can be found a 15-minute walk out of Vecāķi. <b>Riga</b> is famous for its world heritage-listed old town (<i>Vecrīga</i>) and city centre (<i>Centrs</i>), in which over 800 buildings — a third of all buildings — are of the Art Nouveau (aka Jugendstil) style of architecture and thus <b>Riga</b> is one of the best destinations to see this architectural style. Chiefly built in the first years of the 20th century, many of <b>Riga</b>'s Art Nouveau buildings were created by ethnic Latvian architects unlike earlier buildings in the city . The Art Nouveau style involves intricate building facades, with carvings of flowers and mythological creatures, and ornate doorways and windows. A considerable part of the old town was either destroyed by fire or destroyed by the Germans in World War II but many old buildings were also spared. The old town was a draw of the city during the Soviet times and it received protected status in 1967. The damaged parts, most notably the House of the Blackheads, were restored in the late 1990s, mainly to make <b>Riga</b> more attractive as a tourist destination. Another thing that attracts visitors, especially young adults, is the lively nightlife and discount airlines that offer cheap flights to/from much of Europe. <b>Riga</b> is bisected by the river Daugava. Old (medieval) town is in the centre of the city on the east side of the river. It is surrounded by a ring of 19th– to early 20th-century architecture including the Art Nouveau buildings described above, followed by a mix of private 2-floor house districts (many also pre-World War II) and Soviet-era 5-18 floor apartment districts. Especially near railway lines, they are interspersed with industrial plants from different eras, including some from the Imperial Russian era.</wiki_intro>
  <landmark_image>assets/images/riga.jpg</landmark_image>
  <nightlife>
    <venue lat="56.9492836" lon="24.105903" category="pub">
      <name>13 krēsli</name>
    </venue>
    <venue lat="56.9469015" lon="24.1127752" category="bar">
      <name>Aka Latviešu virtuve</name>
    </venue>
    <venue lat="56.9553822" lon="24.1743201" category="bar">
      <name>Alus Dārzs</name>
    </venue>
    <venue lat="56.9263963" lon="24.1701644" category="bar">
      <name>Black dragon</name>
    </venue>
    <venue lat="56.9560192" lon="24.1093673" category="bar">
      <name>Blues House</name>
    </venue>
    <venue lat="56.9466142" lon="24.1103808" category="pub">
      <name>Bon-Vivant</name>
    </venue>
    <venue lat="56.9535179" lon="24.127078" category="pub">
      <name>Bruklinas krogs un viskija bārs</name>
    </venue>
    <venue lat="57.0045916" lon="24.1767692" category="bar">
      <name>Cabo cafe</name>
    </venue>
  </nightlife>
</city_report>
